startdate,enddate,status,ipaddress,progress,duration (in seconds),finished,recordeddate,responseid,recipientlastname,recipientfirstname,recipientemail,externalreference,locationlatitude,locationlongitude,distributionchannel,userlanguage,cid,id,b1oc,b2oc,b3oc,b4oc,b5oc,b6oc,b1ac,b2ac,b3ac,b4ac,b5ac,b6ac,b1ti,b2ti,b3ti,b4ti,b5ti,b6ti,b1sp,b2sp,b3sp,b4sp,b5sp,b6sp,b1cu,b2cu,b3cu,b4cu,b5cu,b6cu,b1re,b2re,b3re,b4re,b5re,b6re,b1su,b2su,b3su,b4su,b5su,b6su,affect,descript,score,rationale,sid,time,vid,double_code,tot_oc,tot_ac,tot_sp,tot_cu,tot_nb,tot_se,tot_ti,tot_su,score_dc_avg,prop_beh_ack,ti_dc_avg,prop_redirect,su_dc_avg,first_beh,q12,q13,q141_1,q141_2,q141_3,q141_4,q141_5,q141_6,q142_1,q142_2,q142_3,q142_4,q142_5,q142_6,q143_1_1,q143_2_1,q143_3_1,q143_4_1,q143_5_1,q143_6_1,q144_1,q144_2,q144_3,q144_4,q144_5,q144_6,q145_1,q145_2,q145_3,q145_4,q145_5,q145_6,q146_1,q146_2,q146_3,q146_4,q146_5,q146_6,q147_1_1,q147_2_1,q147_3_1,q147_4_1,q147_5_1,q147_6_1,q15,q16,q17,q18,q20,q21,q221_1,q221_2,q221_3,q221_4,q221_5,q221_6,q222_1,q222_2,q222_3,q222_4,q222_5,q222_6,q223_1_1,q223_2_1,q223_3_1,q223_4_1,q223_5_1,q223_6_1,q224_1,q224_2,q224_3,q224_4,q224_5,q224_6,q225_1,q225_2,q225_3,q225_4,q225_5,q225_6,q226_1,q226_2,q226_3,q226_4,q226_5,q226_6,q227_1_1,q227_2_1,q227_3_1,q227_4_1,q227_5_1,q227_6_1,q23,q24,q25.1,q26,email_x,id_coach,id_interactor,email_y,email,age,app_adjust_expect,app_adjust_expect_rc,app_beh_manage_coach,app_beh_manage_coach_rc,app_beh_manage_teach,app_beh_manage_teach_rc,app_behavior_plan,app_behavior_plan_rc,app_challenge_work,app_challenge_work_rc,app_coach_stu,app_coach_stu_rc,app_confer_parent,app_confer_parent_rc,app_confer_stu,app_confer_stu_rc,app_discp_refer,app_discp_refer_rc,app_guidance_couns,app_guidance_couns_rc,app_rec_sped,app_rec_sped_rc,app_space_regroup,app_space_regroup_rc,app_spend_time,app_spend_time_rc,beh_acts_smart,beh_defiant,beh_disturbs_others,beh_easily_frustrated,beh_excitable,beh_fidgeting,beh_humming,beh_inattentive,beh_mood_changes,beh_quarrelsome,beh_rating,beh_rating_impulsive,beh_rating_opdefiant,beh_restless,beh_short_attention,beh_uncooperative,beh_unpredictable,btreat_cond,ccs_cohort,ccs_gpa,ccs_major,ccs_majother,ccs_stutype,cpp_year,crtse_05,crtse_06,crtse_07,crtse_08,crtse_09,crtse_10,crtse_12,crtse_13,crtse_14,crtse_15,crtse_16,crtse_17,crtse_18,crtse_19,crtse_20,crtse_22,crtse_23,crtse_24,crtse_25,crtse_27,crtse_28,crtse_30,crtse_31,crtse_33,crtse_35,crtse_36,crtse_41,crtse_total,das_01,das_02,das_03,das_04,das_05,das_06,das_07,das_08,das_09,das_10,das_11,das_12,das_13,das_14,das_15,das_16,das_17,das_18,das_19,das_20,das_21,das_anxiety,das_depression,das_stress,faedu,fall2018coachingnotes,fall2018coachingra,fall2018racera,fb_treat_cond,fit_01,fit_04,fit_05,fit_06,fit_07,fit_08,fit_09,fit_10,fit_11,fit_12,fit_13,fit_total,fustuach,fusturace,fustuses,futeaach,futearace,futeases,gender,grit_01,grit_02,grit_03,grit_04,grit_05,grit_06,grit_07,grit_08,grit_09,grit_10,grit_11,grit_12,grit_total,holang,holangother,hsach,hsloc,hsrace,hsses,hstype,hstypeother,id_participant,id_section,id_site,id_year,imts_01,imts_02,imts_03,imts_04,imts_05,imts_total,manage_app_negative,manage_app_positive,moedu,name,neo_01,neo_02,neo_03,neo_04,neo_05,neo_06,neo_07,neo_08,neo_09,neo_10,neo_11,neo_12,neo_13,neo_14,neo_15,neo_16,neo_17,neo_18,neo_19,neo_20,neo_21,neo_22,neo_23,neo_24,neo_25,neo_26,neo_27,neo_28,neo_29,neo_30,neo_31,neo_32,neo_33,neo_34,neo_35,neo_36,neo_37,neo_38,neo_39,neo_40,neo_41,neo_42,neo_43,neo_44,neo_45,neo_46,neo_47,neo_48,neo_49,neo_50,neo_51,neo_52,neo_53,neo_54,neo_55,neo_56,neo_57,neo_58,neo_59,neo_60,neo_a,neo_c,neo_e,neo_n,neo_o,numofstudents,partch,program_x,program_y,q34,q35_1,q36_1,q37,q38,q39,ra,race,raceother,rannum,rsq_01,rsq_03,rsq_05,rsq_07,rsq_10,rsq_11,rsq_12,rsq_13,rsq_17,rsq_20,rsq_21,rsq_23,rsq_24,rsq_27,rsq_28,rsq_29,rsq_30,rsq_total,section,sim_beneficial,sim_cmsk,sim_enough_time,sim_fbsk,sim_like_use_again,sim_nervous,sim_recommend,sim_relevant_prof,sim_relevant_studies,sim_sufficient_prep,sim_txt_beneficial,sim_txt_cmsk,sim_txt_concerns,sim_txt_eth_behavior,sim_txt_eth_contribute,sim_txt_fbsk,sim_txt_improve_exp,sim_txt_supports,sim_useful_tool,sim_worried_perform,sis_id,spring2019_coaching_original,spring2019_ethan_original,spring2019coachingra,spring2019racera,strata,temp,tmas_01,tmas_02,tmas_03,tmas_04,tmas_06,tmas_07,tmas_10,tmas_11,tmas_12,tmas_13,tmas_14,tmas_15,tmas_16,tmas_17,tmas_18,tmas_19,tmas_20,tmas_total,tr_n,tse_01,tse_02,tse_03,tse_04,tse_05,tse_06,tse_07,tse_08,tse_09,tse_10,tse_11,tse_12,tse_13,tse_14,tse_15,tse_16,tse_17,tse_18,tse_19,tse_20,tse_21,tse_22,tse_23,tse_24,tse_cm,tse_is,tse_se,tse_total,ytrt_01,ytrt_02,ytrt_03,ytrt_04,ytrt_05,ytrt_total,ccs_gpa_miss
,,,,,,,,,,,,,,,,,,,,,,,,,,,,,,,,,,,,,,,,,,,,,,,,,,,,,,,,,,,,,,,,,,0,,,,,,,,,,,,,,,,,,,,,,,,,,,,,,,,,,,,,,,,,,,,,,,,,,,,,,,,,,,,,,,,,,,,,,,,,,,,,,,,,,,,,,,,,,,,,,,,,,,,,,,,,,,,,,,,,,,,,ab2dx@virginia.edu,1,6,5,3,8,8,3,9,2,4,7,2,9,6,5,7,4,2,9,6,5,8,3,9,2,8,3,Just a little,Pretty much,Just a little,Not at all,Very much,Very much,Very much,Very much,Very much,Not at all,2.785714286,3.8,2,Pretty much,Pretty much,Pretty much,Not at all,0,2018,3.46,10,Youth and Social Innovation,1,2018-19,66,58,83,78,92,67,83,80,88,82,72,75,97,80,88,45,89,55,56,71,82,75,25,93,66,70,54,72.962959,2,0,0,1,2,2,0,1,2,0,1,2,0,0,0,0,0,1,1,0,0,0.5714286,0.2857143,1.2857143,1,No coaching conversation,No Coaching,White,0,5,6,1,2,6,7,6,6,6,5,4,4.909091,2,2,2,2,2,2,2,2,3,5,4,5,2,4,4,3,2,4,3,3.4166667,6,Italian,2,1,2,2,6,,1_1819_2_67,2,1,1819,4,4,4,4,3,3.8,4.8,6.75,1,"Basile,Anna",5,3,4,5,4,4,4,2,4,3,5,4,5,5,3,5,4,4,5,4,4,3,4,4,3,5,2,5,4,2,5,2,5,3,4,1,3,4,5,4,5,2,5,2,4,4,4,5,5,3,5,3,3,5,4,5,3,2,5,3,4.3333335,3.4166667,3.0833333,4.4166665,4,39,4,elementary,elementary,,,,,,,CW,5,,0.2828197,4,5,5,3,4,5,4,5,3,5,5,3,5,4,1,5,3,4.0588236,Monday,Somewhat agree,4,Somewhat disagree,5,Somewhat agree,Somewhat agree,Somewhat agree,Somewhat agree,Somewhat agree,Undecided,I think it helped me see the challenges that I may be faced with when I become a teacher ,"'-I tried getting Ethan to tune into the lesson by asking him (in what I think was a polite way) to stop what he was doing, but that approach seemed to be ineffective 
-I think the students would pause and think about my questions when I would include inclusive words such as ""everyone""",How will my videos be used for research purposes?  ,"'-disruptive 
-distracting 
-random 
","'-I know sometimes students are yearning for any kind of attention, so I would be really interested in knowing whether Ethan feels as if he's getting enough attention from the individuals in his home 
-I would also want to find out if Ethan exhibits any other possible signs of a learning disability because if so, I would want to subtly bring that up during a parent-teacher conference with his parents or guardians ","'-I think I helped them understand it a little bit by letting them know that authors in any text chose their words carefully 
-When Savannah offered a really insightful comment, I like how I was able to use that to really leverage the rest of the lesson ","I honestly would have loved to get immediate feedback from someone (a student, a professor) in the teacher education program, because I am a bit worried about my performance ","'-I definitely think that help from a TA or any other kind of specialist would help release some of the stress off of my back. 
-I would love to create a corner where students could go and take a breather if they're ever feeling bored/having a hard time listening and focusing ",Undecided,Strongly agree,ab2dx,No Coaching,Black,No Coaching,Black,Elem Mon,11,4,4,4,4,5,2,4,5,4,4,4,4,4,4,4,4,5,4.0588236,10,7,6,7,7,7,8,7,8,7,8,9,7,7,6,7,6,6,8,5,7,6,6,8,6,6.625,7.375,6.75,6.9166665,5,4,6,6,6,5.4000001,0
,,,,,,,7/14/19 10:16,,,,,,,,,,Stephanie,67,1,1,1,1,1,1,1,1,1,1,1,0,24,10,39,32,45,-,0,0,0,0,0,0,1,1,1,1,1,1,1,1,1,1,1,2,33,58,17,8,50,-,Teacher seemed to get frustrated with behaviors,"T raised voice over Ethan without addressing
T’s facial expression showed that she was frustrated.
",1,"No classroom norms were discussed
Almost all of the time was directed to behaviors
T did not successfully stop any behaviors.
",8,3,67_2,1,6,5,0,6,5,1,150,166,1,0.833333333,30,0,33.2,Ethan humming,,,,,,,,,,,,,,,,,,,,,,,,,,,,,,,,,,,,,,,,,,,,,,,,,,,,,,,,,,,,,,,,,,,,,,,,,,,,,,,,,,,,,,,,,,,,,,,,,,,,ab2dx@virginia.edu,ab2dx@virginia.edu,1,8,3,6,5,5,6,9,2,4,7,2,9,7,4,8,3,2,9,3,8,3,8,9,2,7,4,Just a little,Not at all,Very much,Just a little,Pretty much,Pretty much,Very much,Pretty much,Not at all,Not at all,2.5,3,2,Pretty much,Just a little,Very much,Just a little,0,2018,3.46,10,Youth and Social Innovation,1,2018-19,66,58,83,78,92,67,83,80,88,82,72,75,97,80,88,45,89,55,56,71,82,75,25,93,66,70,54,72.962959,2,0,0,1,2,2,0,1,2,0,1,2,0,0,0,0,0,1,1,0,0,0.5714286,0.2857143,1.2857143,1,No coaching conversation,No Coaching,White,0,5,6,1,2,6,7,6,6,6,5,4,4.909091,2,2,2,2,2,2,2,2,3,5,4,5,2,4,4,3,2,4,3,3.4166667,6,Italian,2,1,2,2,6,,1_1819_2_67,2,1,1819,4,4,4,4,3,3.8,3.6,6.875,1,"Basile,Anna",5,3,4,5,4,4,4,2,4,3,5,4,5,5,3,5,4,4,5,4,4,3,4,4,3,5,2,5,4,2,5,2,5,3,4,1,3,4,5,4,5,2,5,2,4,4,4,5,5,3,5,3,3,5,4,5,3,2,5,3,4.3333335,3.4166667,3.0833333,4.4166665,4,39,4,elementary,elementary,Yes,3,4,No,,,CW,5,,0.2828197,4,5,5,3,4,5,4,5,3,5,5,3,5,4,1,5,3,4.0588236,Monday,Strongly disagree,2,Somewhat agree,7,Strongly disagree,Somewhat agree,Undecided,Somewhat disagree,Somewhat disagree,Somewhat agree,,"I was unable to get Ethan and Dev to stop distracting others, and that affects other students' ability to focus and engage in the discussion 
You can see that I didn't start the conversation off by listing my expectation for the students before the discussion started, which I think really opened the door for students to misbehave 
",Doesn't really feel like it actually helps me improve my skills as a future educator. Have never gotten in-person coaching from anyone on my performance. The fact that no one will ever go through my video recording with me to discuss what could have gone better. ,"distracting, disrespectful, impulsive","lack of attention from adults in his life, some underlying learning disability, recent changes in his personal life 

if any of the factors listed above this are actually accurate  ","I think that all of the students made great points, so I tried my best to highlight those and tie them to other students' points.
I didn't discount the idea that Lisa could have been feeling excited, instead I asked for other thoughts and through that we were able to pinpoint that Lisa really was feeling nervous because of her concealed identity 
",,"Mindfulness practices, an SEL curriculum, discussing with other teachers to see if there are any strategies that have worked with them ",Somewhat disagree,Strongly agree,ab2dx,No Coaching,Black,No Coaching,Black,Elem Mon,11,4,4,4,4,5,2,4,5,4,4,4,4,4,4,4,4,5,4.0588236,10,7,6,7,7,7,8,7,8,7,8,9,7,7,6,7,6,6,8,5,7,6,6,8,6,6.625,7.375,6.75,6.9166665,5,4,6,6,6,5.4000001,0
,,,,,,,4/9/19 13:49,,,,,,,,,,Rachel L,67,1,1,1,1,1,1,1,1,1,0,1,1,16,24,30,,15,5,0,0,0,,0,0,0,1,1,,1,1,,1,1,,1,2,8,32,24,,38,27,Unsure,Laughs to self when redirections are not successful as if she‚Äôs not sure what to do; tries to ignore behaviors,2,"TC is not able to support students in generating classroom norms (comes up with 1 or 2 herself). TC is largely unsuccessful redirecting off-task behavior‚Äînone of the redirections are specific and many are lengthy, which detracts from the quality of the discussion. The majority of the simulation is either the TC trying to redirect misbehavior or trying to keep the conversation afloat. TC remains calm (does not raise voice, etc), but does seem somewhat unsure. ",5,1,67_2,1,6,5,0,4,3,1,90,129,2,0.833333333,18,0,25.8,Ethan humming,,,,,,,,,,,,,,,,,,,,,,,,,,,,,,,,,,,,,,,,,,,,,,,,,,,,,,,,,,,,,,,,,,,,,,,,,,,,,,,,,,,,,,,,,,,,,,,,,ab2dx@virginia.edu,Emily,Jim,ab2dx@virginia.edu,ab2dx@virginia.edu,,,,,,,,,,,,,,,,,,,,,,,,,,,,,,,,,,,,,,,,,,,,,,,,,,,,,,,,,,,,,,,,,,,,,,,,,,,,,,,,,,,,,,,,,,,,,,,,,,,,,,,,,,,,,,,,,,,,,,,,,,,,,,,,,,,,,,,,,,,,,,,,,,,,,,,,,,,,,,,,,,,,,,,,,,,,,,,,,,,,,,,,,,,,,,,,,,,,,,,,,,,,,,,,,,,,,,,,,,,,,,,,,,,,,,,,,,,,,,,,,,,,,,,,,,,,,,,,,,,,,,,,,,,,,,,,,,,,,,,,,,,,,,,,,,,,,,,,,,,,,,,,,,,,,,,,,,,,,,,,,,,,,,,,,,,,,,,,,,,,,1
,,,,,,,4/9/19 14:21,,,,,,,,,,Rachel L,67,1,1,1,1,1,1,1,1,1,1,1,0,25,2,23,39,33,6,0,0,0,0,0,0,1,1,1,1,1,1,1,1,1,1,1,2,27,53,29,9,16,32,Unsure,Tries to engage with students about misbehaviors; tries to ignore off-task behavior,2,"TC is not able to support students in generating any classroom norms. TC is unsuccessful with redirecting off-task behavior as she takes a while to acknowledge misbehaviors and redirections are lengthy, which detracts from the quality of the conversation. The whole simulation is focused on either TC trying to redirect or trying to keep conversation afloat. TC does not support student engagement. ",6,2,67_2,1,6,5,0,6,5,1,128,166,2,0.833333333,25.6,0,33.2,Ethan video game,,,,,,,,,,,,,,,,,,,,,,,,,,,,,,,,,,,,,,,,,,,,,,,,,,,,,,,,,,,,,,,,,,,,,,,,,,,,,,,,,,,,,,,,,,,,,,,,,ab2dx@virginia.edu,Emily,Jim,ab2dx@virginia.edu,ab2dx@virginia.edu,,,,,,,,,,,,,,,,,,,,,,,,,,,,,,,,,,,,,,,,,,,,,,,,,,,,,,,,,,,,,,,,,,,,,,,,,,,,,,,,,,,,,,,,,,,,,,,,,,,,,,,,,,,,,,,,,,,,,,,,,,,,,,,,,,,,,,,,,,,,,,,,,,,,,,,,,,,,,,,,,,,,,,,,,,,,,,,,,,,,,,,,,,,,,,,,,,,,,,,,,,,,,,,,,,,,,,,,,,,,,,,,,,,,,,,,,,,,,,,,,,,,,,,,,,,,,,,,,,,,,,,,,,,,,,,,,,,,,,,,,,,,,,,,,,,,,,,,,,,,,,,,,,,,,,,,,,,,,,,,,,,,,,,,,,,,,,,,,,,,,1
,,,,,,,4/7/19 21:41,,,,,,,,,,Claire,86,1,1,1,1,1,1,1,1,1,1,1,1,27,6,17,6,23,9,1,0,1,1,1,1,0,1,0,0,0,1,,1,,,,2,29,49,5,11,7,7,firm,"'-doesn‚Äôt smile a lot
-uses please and thank you when giving redirections
",7,"'- The teaching candidate supported students in generating 2-3 reasonable classroom expectations as well as a rationale for them.
-TC redirection ‚Öö misbehaviors. However, some misbehaviors were lengthier and detract from the overall quality of the conversation...could have been more succinct.
-TC took awhile to acknowledge some of the behaviors.
-Teacher candidate affect is confident and they remain unruffled throughout the simulation. 
Dialogue is sometimes focused on classroom norms and their rationale. At other times it is (a) focused on students and their misbehavior, (b) used in attempts to keep the discussion afloat during unaddressed student misbehavior 
",5,1,86_2,1,6,6,5,2,1,1,88,108,7,1,14.66666667,0.833333333,18,Ethan humming,,,,,,,,,,,,,,,,,,,,,,,,,,,,,,,,,,,,,,,,,,,,,,,,,,,,,,,,,,,,,,,,,,,,,,,,,,,,,,,,,,,,,,,,,,,,,,,,,ac4ah@virginia.edu,Casedy,Carrie,ac4ah@virginia.edu,ac4ah@virginia.edu,,,,,,,,,,,,,,,,,,,,,,,,,,,,,,,,,,,,,,,,,,,,,,,,,,,,,,,,,,,,,,,,,,,,,,,,,,,,,,,,,,,,,,,,,,,,,,,,,,,,,,,,,,,,,,,,,,,,,,,,,,,,,,,,,,,,,,,,,,,,,,,,,,,,,,,,,,,,,,,,,,,,,,,,,,,,,,,,,,,,,,,,,,,,,,,,,,,,,,,,,,,,,,,,,,,,,,,,,,,,,,,,,,,,,,,,,,,,,,,,,,,,,,,,,,,,,,,,,,,,,,,,,,,,,,,,,,,,,,,,,,,,,,,,,,,,,,,,,,,,,,,,,,,,,,,,,,,,,,,,,,,,,,,,,,,,,,,,,,,,,1
,,,,,,,,,,,,,,,,,,,,,,,,,,,,,,,,,,,,,,,,,,,,,,,,,,,,,,,,,,,,,,,,,,0,,,,,,,,,,,,,,,,,,,,,,,,,,,,,,,,,,,,,,,,,,,,,,,,,,,,,,,,,,,,,,,,,,,,,,,,,,,,,,,,,,,,,,,,,,,,,,,,,,,,,,,,,,,,,,,,,,,,,ac4ah@virginia.edu,1,3,8,7,4,8,3,8,3,1,10,7,4,7,4,8,3,1,10,6,5,1,10,8,3,6,5,Just a little,Pretty much,Pretty much,Not at all,Just a little,Pretty much,Very much,Pretty much,Just a little,Not at all,2.357142857,2.8,2,Pretty much,Just a little,Pretty much,Not at all,0,2018,3.88,10,Chemistry ,1,2018-19,58,61,53,74,80,83,83,84,85,52,81,61,66,82,85,63,79,83,80,80,67,65,64,79,83,86,79,73.925926,0,0,0,0,1,0,0,0,0,0,0,0,0,0,0,0,0,0,0,0,0,0,0.14285715,0,5,No coaching conversation,No Coaching,Black,0,5,4,5,5,6,6,4,6,5,4,6,5.090909,2,2,2,2,2,2,2,2,3,2,3,2,2,2,2,2,3,2,1,2.1666667,2,,2,2,2,2,6,,1_1819_3_86,3,1,1819,3,4,4,4,3,3.5999999,3.6,6.625,4,"Copley,Abigail",3,2,2,4,4,2,3,2,4,4,3,3,4,3,4,2,4,4,4,2,2,3,4,3,3,2,3,3,4,2,5,3,4,4,4,2,4,3,4,4,3,4,2,3,4,3,4,4,4,4,2,4,4,3,4,3,4,4,3,4,3.5833333,3.5833333,3.4166667,2.6666667,3.3333333,36,4,,elementary,,,,,,,CB,5,,0.0169608,3,4,3,4,3,3,4,3,4,4,4,4,4,4,2,3,4,3.5294118,Tuesday,Strongly agree,2,Somewhat agree,3,Undecided,Somewhat agree,Somewhat agree,Somewhat agree,Somewhat agree,Undecided,"It was interesting to see my personal reaction to these situations without the support of another teacher in the room
Seeing the way potential students may act in a classroom","'-Our conversation about classroom norms was not very productive
-It was difficult for me to manage the behavior in the classroom","Will there be a debrief on how these situations could be handled
","'-Distracting 
-Disruptive
-Unproductive to the task at hand","'-Ethan seemed to be seeking attention 
-He is interested in music and acting out situations
-There might be a situation going on outside of the classroom that might be effecting Ethan's behavior

-I would like to know about Ethan's prior behavior in classrooms and his homelife","'-We did not get very far though the story
-The students were able to recall parts of the text as evidence for their answers","Being able to create a course of action beforehand
Creating lessons to do this
Having the skills to address this situation
Feedback on how to address these situation
","'-I would talk to a coach, specialist and other teachers about the best way to manage this type of behavior. 
-Schedule and expectations
-Strategies to help the students refocus
",Somewhat agree,Undecided,ac4ah,No Coaching,Black,No Coaching,Black,Elem Tues,1,4,4,4,4,4,4,4,4,4,4,4,4,4,4,4,4,4,4,9,7,8,7,7,8,8,7,7,7,7,7,7,7,6,6,7,7,8,5,8,5,8,7,7,6.5,7.25,7.25,7,5,5,6,6,6,5.5999999,0
,,,,,,,4/6/19 13:07,,,,,,,,,,Rachel G,86,1,1,1,1,1,1,1,1,1,1,1,0,9,4,9,4,3,13,0,1,1,1,0,0,1,0,0,0,1,1,1,,,,1,2,46,5,32,41,45,32,unsure,"Hesitates with being specific, engages with the behaviors ",4,"2 norms created, some redirections specific but all lengthy, most dialogue focused on misbehaviors, some moments when all students were engaged, teacher seems calm but unsure",6,2,86_2,1,6,5,3,3,2,1,42,201,4,0.833333333,8.4,0.6,40.2,Ethan video game,,,,,,,,,,,,,,,,,,,,,,,,,,,,,,,,,,,,,,,,,,,,,,,,,,,,,,,,,,,,,,,,,,,,,,,,,,,,,,,,,,,,,,,,,,,,,,,,,ac4ah@virginia.edu,Casedy,Carrie,ac4ah@virginia.edu,ac4ah@virginia.edu,1,2,9,9,2,7,4,8,3,6,5,4,7,7,4,9,2,2,9,6,5,2,9,7,4,8,3,Not at all,Just a little,Very much,Just a little,Pretty much,Pretty much,Very much,Very much,Just a little,Just a little,2.571428571,3.6,1.6,Just a little,Very much,Just a little,Not at all,0,2018,3.88,10,Chemistry ,1,2018-19,58,61,53,74,80,83,83,84,85,52,81,61,66,82,85,63,79,83,80,80,67,65,64,79,83,86,79,73.925926,0,0,0,0,1,0,0,0,0,0,0,0,0,0,0,0,0,0,0,0,0,0,0.14285715,0,5,No coaching conversation,No Coaching,Black,0,5,4,5,5,6,6,4,6,5,4,6,5.090909,2,2,2,2,2,2,2,2,3,2,3,2,2,2,2,2,3,2,1,2.1666667,2,,2,2,2,2,6,,1_1819_3_86,3,1,1819,3,4,4,4,3,3.5999999,3.2,7.625,4,"Copley,Abigail",3,2,2,4,4,2,3,2,4,4,3,3,4,3,4,2,4,4,4,2,2,3,4,3,3,2,3,3,4,2,5,3,4,4,4,2,4,3,4,4,3,4,2,3,4,3,4,4,4,4,2,4,4,3,4,3,4,4,3,4,3.5833333,3.5833333,3.4166667,2.6666667,3.3333333,36,4,,elementary,,,,,,,CB,5,,0.0169608,3,4,3,4,3,3,4,3,4,4,4,4,4,4,2,3,4,3.5294118,Tuesday,Undecided,3,Undecided,,Somewhat disagree,Somewhat agree,Somewhat disagree,Somewhat disagree,Undecided,Somewhat disagree,Understanding a situation that could happen in my classroom,Classroom management was low because students were not able to focus and were constantly getting distracted. Student engagement was low so classroom management was not effective,I will not understand how to deal with a student like this in a productive manner in the future,"Distracting
Unnecessay","External influences from home
Lack of structure or norms at home or outside of the classroom
I would want to know about the students home life and other teachers' past experiences with him",,Understanding what I should do in this situation,"talking to other teachers and people with more experience with these behaviors
Education on what to do in these situations",Undecided,Somewhat agree,ac4ah,No Coaching,Black,No Coaching,Black,Elem Tues,1,4,4,4,4,4,4,4,4,4,4,4,4,4,4,4,4,4,4,9,7,8,7,7,8,8,7,7,7,7,7,7,7,6,6,7,7,8,5,8,5,8,7,7,6.5,7.25,7.25,7,5,5,6,6,6,5.5999999,0
,,,,,,,7/20/19 17:56,,,,,,,,,,Rosalie,86,1,1,1,1,1,1,1,1,1,1,1,1,11,3,2,3,3,8,1,0,0,1,1,1,0,0,1,1,0,0,,,1,1,,,4,7,46,42,15,7,Was relatively calm throughout,"Did not raise voice at Ethan, but was firm about redirection
Tried to include Ethan in discussion by asking questions
",6,"Generated 2-3 classroom norms with rationale
Had mixed success with redirections
Most of the dialogue was on classroom norms, but the teacher tended to integrate the  misbehaviors as part of her norms
Teacher’s affect remained calm for most of simulation 
",8,3,86_2,0,6,6,4,2,2,0,30,121,6,1,5,0.666666667,20.16666667,Ethan humming,,,,,,,,,,,,,,,,,,,,,,,,,,,,,,,,,,,,,,,,,,,,,,,,,,,,,,,,,,,,,,,,,,,,,,,,,,,,,,,,,,,,,,,,,,,,,,,,,,,,ac4ah@virginia.edu,ac4ah@virginia.edu,1,3,8,5,6,8,3,5,6,7,4,5,6,8,3,10,1,3,8,5,6,2,9,8,3,8,3,Not at all,Not at all,Pretty much,Not at all,Not at all,Pretty much,Pretty much,Very much,Not at all,Not at all,2,2.6,1.4,Pretty much,Just a little,Pretty much,Not at all,0,2018,3.88,10,Chemistry ,1,2018-19,58,61,53,74,80,83,83,84,85,52,81,61,66,82,85,63,79,83,80,80,67,65,64,79,83,86,79,73.925926,0,0,0,0,1,0,0,0,0,0,0,0,0,0,0,0,0,0,0,0,0,0,0.14285715,0,5,No coaching conversation,No Coaching,Black,0,5,4,5,5,6,6,4,6,5,4,6,5.090909,2,2,2,2,2,2,2,2,3,2,3,2,2,2,2,2,3,2,1,2.1666667,2,,2,2,2,2,6,,1_1819_3_86,3,1,1819,3,4,4,4,3,3.5999999,3.6,7.375,4,"Copley,Abigail",3,2,2,4,4,2,3,2,4,4,3,3,4,3,4,2,4,4,4,2,2,3,4,3,3,2,3,3,4,2,5,3,4,4,4,2,4,3,4,4,3,4,2,3,4,3,4,4,4,4,2,4,4,3,4,3,4,4,3,4,3.5833333,3.5833333,3.4166667,2.6666667,3.3333333,36,4,,elementary,No,,,,,,CB,5,,0.0169608,3,4,3,4,3,3,4,3,4,4,4,4,4,4,2,3,4,3.5294118,Tuesday,Undecided,6,Undecided,5,Somewhat disagree,Somewhat agree,Undecided,Undecided,Undecided,Somewhat disagree,"experience with different classroom situations
safe practice space","We were able to come up with 2 expectations
It was hard to solidify the expectations and move on",No feedback on ways to improve my teaching,He was a distraction and clearly not engaged,"I think the material was uninteresting to him
Not having established a relationship with him also made it hard to address the problem as a warm demander","Most students were able to talk
Not many feedback loops
was able to get them looking in the text and explaining their answers","Preparation materials sent the 2-3 days before hand
","Structure, 
An introduction
expectations to participate
experience to draw from",Undecided,Somewhat disagree,ac4ah,No Coaching,Black,No Coaching,Black,Elem Tues,1,4,4,4,4,4,4,4,4,4,4,4,4,4,4,4,4,4,4,9,7,8,7,7,8,8,7,7,7,7,7,7,7,6,6,7,7,8,5,8,5,8,7,7,6.5,7.25,7.25,7,5,5,6,6,6,5.5999999,0
