,,,,,,,7/14/19 16:19,,,,,,,,,,Andrew,60,1,1,1,1,1,1,1,1,1,1,1,1,3,5,4,6,18,9,1,1,0,0,1,1,0,0,1,1,0,0,,,1,1,,,16,16,48,33,36,4,Generally calm and positive with a few moments of frustration,"Smiling at first but begins to raise voice
Starts ignoring misbehavior",4,"Teacher generates 2 norms but does not develop rationales
She uses a mix of specific and non-specific redirections but almost all of them are quite lengthy; as a result, nearly all of the class discussion is spent redirecting
Affect is mostly calm and positive, but she does get visibly frustrated as the simulation continues and ignores misbehaviors for a brief part at the end",8,3,60_2,0,6,6,4,2,2,0,45,153,4,1,7.5,0.666666667,25.5,Ethan humming,,,,,,,,,,,,,,,,,,,,,,,,,,,,,,,,,,,,,,,,,,,,,,,,,,,,,,,,,,,,,,,,,,,,,,,,,,,,,,,,,,,,,,,,,,,,,,,,,,,,nf2ke@virginia.edu,nf2ke@virginia.edu,1,6,5,8,3,5,6,9,2,7,4,4,7,8,3,9,2,4,7,5,6,5,6,8,3,9,2,Just a little,Pretty much,Very much,Pretty much,Just a little,Pretty much,Very much,Very much,Just a little,Pretty much,2.928571429,3.2,2.6,Pretty much,Pretty much,Pretty much,Just a little,0,2018,3.4,10,Foreign Affairs,1,2018-19,70,63,75,90,80,80,85,87,91,80,83,90,100,100,100,100,100,90,85,90,100,88,100,100,90,85,93,88.703705,1,1,0,0,1,0,0,0,0,1,0,1,1,1,0,1,0,0,0,1,1,0.2857143,0.71428573,0.42857143,5,No coaching conversation,No Coaching,Black,0,7,7,7,7,7,7,7,7,6,7,7,6.909091,2,2,2,2,2,2,2,2,4,2,4,3,2,3,3,2,1,3,2,2.5833333,6,Farsi ,2,2,3,2,6,,1_1819_2_60,2,1,1819,4,4,3,4,2,3.4000001,4.8,7.875,5,"Feraidon,Naira",2,4,3,5,4,3,5,1,4,4,3,2,4,4,3,3,4,3,4,4,2,3,3,3,4,3,2,4,2,2,3,3,2,4,4,3,4,4,5,4,4,4,3,3,4,4,3,3,5,5,2,4,4,3,4,3,4,4,4,4,3.8333333,3.8333333,3.5,2.9166667,3.1666667,39,1,elementary,elementary,Yes,6,7,Yes,,,CB,7,Central Asian,0.2031778,2,4,2,2,3,3,3,3,3,4,4,4,4,3,4,3,3,3.1764705,Monday,Somewhat agree,7,Somewhat agree,7,Strongly agree,Somewhat disagree,Strongly agree,Strongly agree,Strongly agree,Undecided,It's good practice! I find the zoom simulators to be really beneficial because I get to look back and review my own performance. ,"'-Ethan would listen to me but would immediately start another form of distraction. 
-Focusing on Ethan took away from the discussion.   ",no concerns,Ethan was very distracted.  He looked for distraction and was very bored with the discussion.  ,"If Ethan was a real student, I think I would ask to take his phone for the moment, or ask him to place it in his backpack.  I would also ask him more questions directly so that I could figure out how to get him interested in the discussion.  

Overall, I would have many more days with Ethan, which would hopefully build our relationship and improve his behavior. 
","'-At the very end, I feel like I confused them with one of my questions.  Once they noted that they were confused, I tried to take a different approach. 
-I also wanted them to get to theanswer themselves without getting in the way, which likely confused them some more. ",getting to see my performance afterwards! ,"I think it is important that Ethan would be a part of that conversation so asking him to sit out would not be something I would consider.  I would, however, want his undivided attention.  Maybe I would let the kids write three rules on a piece of paper and then hand it to me and we would have a discussion.  During that process, if Ethan is uninterested and out of task, I would work with him one on one. ",Somewhat agree,Somewhat disagree,nf2ke,No Coaching,White,No Coaching,White,Elem Mon,6,4,5,4,5,3,3,5,5,5,5,5,4,4,4,5,3,3,4.2352943,10,6,6,6,5,7,7,7,7,6,6,6,7,7,7,4,6,8,6,6,7,6,7,6,7,6.125,6.625,6.375,6.375,7,7,7,7,7,7,0
,,,,,,,,,,,,,,,,,,,,,,,,,,,,,,,,,,,,,,,,,,,,,,,,,,,,,,,,,,,,,,,,,,2,,,,,,,,,,,,,,,,,,,,,,,,,,,,,,,,,,,,,,,,,,,,,,,,,,,,,,,,,,,,,,,,,,,,,,,,,,,,,,,,,,,,,,,,,,,,,,,,,,,,,,,,,,,,,,,,,,,,,nf2ke@virginia.edu,1,8,3,9,2,7,4,9,2,4,7,4,7,8,3,9,2,3,8,7,4,5,6,8,3,6,5,Just a little,Just a little,Pretty much,Not at all,Pretty much,Pretty much,Pretty much,Very much,Just a little,Just a little,2.428571429,3,2,Pretty much,Just a little,Pretty much,Not at all,0,2018,3.4,10,Foreign Affairs,1,2018-19,70,63,75,90,80,80,85,87,91,80,83,90,100,100,100,100,100,90,85,90,100,88,100,100,90,85,93,88.703705,1,1,0,0,1,0,0,0,0,1,0,1,1,1,0,1,0,0,0,1,1,0.2857143,0.71428573,0.42857143,5,No coaching conversation,No Coaching,Black,0,7,7,7,7,7,7,7,7,6,7,7,6.909091,2,2,2,2,2,2,2,2,4,2,4,3,2,3,3,2,1,3,2,2.5833333,6,Farsi ,2,2,3,2,6,,1_1819_2_60,2,1,1819,4,4,3,4,2,3.4000001,5.4,7.5,5,"Feraidon,Naira",2,4,3,5,4,3,5,1,4,4,3,2,4,4,3,3,4,3,4,4,2,3,3,3,4,3,2,4,2,2,3,3,2,4,4,3,4,4,5,4,4,4,3,3,4,4,3,3,5,5,2,4,4,3,4,3,4,4,4,4,3.8333333,3.8333333,3.5,2.9166667,3.1666667,39,1,elementary,elementary,,,,,,,CB,7,Central Asian,0.2031778,2,4,2,2,3,3,3,3,3,4,4,4,4,3,4,3,3,3.1764705,Monday,Somewhat agree,6,Somewhat agree,,Undecided,Undecided,Undecided,Strongly agree,Strongly agree,Undecided,Getting practice scenarios and the coaching is going to help me in my professional career.,"'-I was able to facilitate discussion to a certain extent.  The students would get of topic at times but I tired to get them back on track. 
-I don't think I was direct enough with the students, particularly with Ethan and especially during the first round of simulations. ",No concerns,"'-He would get distracted a lot and would distract others as well, by whispering, making noise or getting off topic. ","He clearly has a lot that he wants to share with others, which he would be able to do during free time or lunch time, but since that norm isn't set (since it is the first day of school), he was being disruptive.  He also wouldn't pay attention at times by making noises, which would mean that he isn't engaging in the conversation.  ",,Seeing a good example after I finished my simulation. ,"'-We will need solid classroom norms with specific examples of good behavior. Like staying on topic, no distractions and being present. 
",Somewhat agree,Somewhat disagree,nf2ke,No Coaching,White,No Coaching,White,Elem Mon,6,4,5,4,5,3,3,5,5,5,5,5,4,4,4,5,3,3,4.2352943,10,6,6,6,5,7,7,7,7,6,6,6,7,7,7,4,6,8,6,6,7,6,7,6,7,6.125,6.625,6.375,6.375,7,7,7,7,7,7,0
,,,,,,,,,,,,,,,,,,,,,,,,,,,,,,,,,,,,,,,,,,,,,,,,,,,,,,,,,,,,,,,,,,0,,,,,,,,,,,,,,,,,,,,,,,,,,,,,,,,,,,,,,,,,,,,,,,,,,,,,,,,,,,,,,,,,,,,,,,,,,,,,,,,,,,,,,,,,,,,,,,,,,,,,,,,,,,,,,,,,,,,,npg7wf@virginia.edu,2,6,5,3,8,10,1,10,1,3,8,8,3,8,3,9,2,3,8,7,4,3,8,2,9,6,5,Not at all,Not at all,Not at all,Not at all,Just a little,Very much,Very much,Very much,Not at all,Not at all,2.071428571,3.2,1.2,Very much,Just a little,Just a little,Not at all,0,2018,3.46,10,Systems Engineering,2,2018-19,40,40,55,50,80,65,50,40,50,45,45,60,25,40,85,25,70,65,65,50,50,45,50,60,50,60,50,52.222221,2,0,0,1,1,0,0,0,1,0,1,0,0,0,0,1,0,0,0,0,0,0.2857143,0.2857143,0.42857143,4,No coaching conversation,No Coaching,White,0,6,4,2,4,5,5,6,6,4,2,5,4.4545455,1,2,2,2,2,2,1,2,2,2,4,2,2,4,3,2,1,3,2,2.4166667,2,,2,1,3,2,6,,1_1819_3_79,3,1,1819,4,5,4,4,5,4.4000001,5.4,6.375,5,"Green,Noah Patrick",2,2,4,5,3,1,5,3,5,3,2,4,3,5,3,3,3,4,5,4,2,4,3,5,3,1,4,5,4,1,2,2,4,4,4,1,5,5,5,5,1,5,3,4,5,2,1,2,5,4,2,2,4,4,3,3,2,4,5,4,4.6666665,3.5,3.25,1.8333334,3.6666667,36,1,,elementary,,,,,,,CW,5,,0.3084691,4,1,3,4,4,3,4,1,5,1,2,4,1,4,3,3,1,2.8235295,Tuesday,Strongly agree,8,Strongly agree,7,Somewhat agree,Somewhat agree,Strongly agree,Strongly agree,Strongly agree,Strongly agree,I was able to practice behavior management skills I've picked up outside of Curry.,"1. Ethan(?) was able to stop his behaviors pretty quickly when asked.
2. I maintained a level head and didn't get down on students when they got off topic.",Will this prepare us for larger classes? Am I gauging myself accurately? I wish I could get feedback on what we just completed.,"1. He was very distracted and hyper (table drumming, whistling, off topic identification with Darth Vader, impressions)
2. He was able to stop when asked, but didn't connect previous poor behaviors with his current actions.","1. He might be nervous because it's the first day.
2. He might be high energy because he isn't used to spending so much time inside after the summer.
3. I would like to know how he was in previous classes and if teachers have had specific strategies for helping him manage his impulses (pre-loading, collaboration, body movement breaks, etc.)","1. I asked the students to look at the text after she said her heart was pounding to determine her emotion.
2. I asked for predictions for who Lisa is and reasons for why they thought that. One student responded using text references.","It was pretty well set up. Headphones might be helpful to make sure I can understand them, but I was able to hear them surprisingly well.","1. Only Ethan was really talking out of turn, but a talking stick might be helpful.
2. Make a reward system for providing on topic responses.
3. Appreciate peers for not feeding into poor behaviors.",Strongly agree,Somewhat disagree,npg7wf,No Coaching,Black,No Coaching,Black,Elem Tues,12,3,4,2,4,4,3,3,4,4,4,3,4,4,4,4,4,4,3.6470587,9,5,6,8,6,8,6,5,8,5,5,6,4,8,5,8,8,5,5,8,6,7,4,4,5,7.875,5.125,5.125,6.0416665,7,7,6,6,6,6.4000001,0
,,,,,,,4/7/19 14:08,,,,,,,,,,Maggie,79,1,1,1,1,1,1,1,1,1,1,1,1,16,21,14,3,21,2,1,1,1,0,0,0,0,0,0,1,1,1,,,,1,1,2,14,28,30,40,37,21,"Warm, calm",TC maintained consistent kind voice and disposition throughout the simulation. Didn‚Äôt change tone when redirecting behavior or engaging in discussion with students misbehaving. ,5,"TC supported students in generating 2 reasonable expectations. TC attempted with mixed success to redirect off task behavior. Most disruptions detracted from overall quality of the discussion. Dialogue is sometimes focused on classroom norms, but mostly focused on the misbehaviors. ",5,1,79_2,1,6,6,3,3,2,1,77,170,5,1,12.83333333,0.5,28.33333333,Ethan humming,,,,,,,,,,,,,,,,,,,,,,,,,,,,,,,,,,,,,,,,,,,,,,,,,,,,,,,,,,,,,,,,,,,,,,,,,,,,,,,,,,,,,,,,,,,,,,,,,npg7wf@virginia.edu,Arielle,Jim,npg7wf@virginia.edu,npg7wf@virginia.edu,,,,,,,,,,,,,,,,,,,,,,,,,,,,,,,,,,,,,,,,,,,,,,,,,,,,,,,,,,,,,,,,,,,,,,,,,,,,,,,,,,,,,,,,,,,,,,,,,,,,,,,,,,,,,,,,,,,,,,,,,,,,,,,,,,,,,,,,,,,,,,,,,,,,,,,,,,,,,,,,,,,,,,,,,,,,,,,,,,,,,,,,,,,,,,,,,,,,,,,,,,,,,,,,,,,,,,,,,,,,,,,,,,,,,,,,,,,,,,,,,,,,,,,,,,,,,,,,,,,,,,,,,,,,,,,,,,,,,,,,,,,,,,,,,,,,,,,,,,,,,,,,,,,,,,,,,,,,,,,,,,,,,,,,,,,,,,,,,,,,,1
,,,,,,,4/11/19 13:59,,,,,,,,,,Maggie,79,1,1,1,1,1,1,1,1,1,1,1,0,11,2,3,2,24,8,0,1,1,0,0,0,1,0,1,0,1,1,1,,1,,1,2,49,19,38,18,26,21,Calm,"TC didn‚Äôt change his affect throughout the video, maintained consistent tone and level of voice throughout. ",3,TC supports students in generating 1 norm. TC attempted with one success to redirect off task behavior. Disruptions were lengthy and detracted from overall quality. Majority of sounds are TC engaging with students about their misbehavior. TC affect was calm,6,2,79_2,1,6,5,2,4,3,1,50,171,3,0.833333333,10,0.4,34.2,Ethan video game,,,,,,,,,,,,,,,,,,,,,,,,,,,,,,,,,,,,,,,,,,,,,,,,,,,,,,,,,,,,,,,,,,,,,,,,,,,,,,,,,,,,,,,,,,,,,,,,,npg7wf@virginia.edu,Arielle,Jim,npg7wf@virginia.edu,npg7wf@virginia.edu,2,4,7,8,3,9,2,8,3,3,8,8,3,9,2,10,1,2,9,8,3,2,9,7,4,8,3,Not at all,Just a little,Just a little,Not at all,Pretty much,Pretty much,Very much,Pretty much,Not at all,Not at all,2,3,1.2,Pretty much,Just a little,Not at all,Not at all,0,2018,3.46,10,Systems Engineering,2,2018-19,40,40,55,50,80,65,50,40,50,45,45,60,25,40,85,25,70,65,65,50,50,45,50,60,50,60,50,52.222221,2,0,0,1,1,0,0,0,1,0,1,0,0,0,0,1,0,0,0,0,0,0.2857143,0.2857143,0.42857143,4,No coaching conversation,No Coaching,White,0,6,4,2,4,5,5,6,6,4,2,5,4.4545455,1,2,2,2,2,2,1,2,2,2,4,2,2,4,3,2,1,3,2,2.4166667,2,,2,1,3,2,6,,1_1819_3_79,3,1,1819,4,5,4,4,5,4.4000001,4.8,7.75,5,"Green,Noah Patrick",2,2,4,5,3,1,5,3,5,3,2,4,3,5,3,3,3,4,5,4,2,4,3,5,3,1,4,5,4,1,2,2,4,4,4,1,5,5,5,5,1,5,3,4,5,2,1,2,5,4,2,2,4,4,3,3,2,4,5,4,4.6666665,3.5,3.25,1.8333334,3.6666667,36,1,,elementary,,,,,,,CW,5,,0.3084691,4,1,3,4,4,3,4,1,5,1,2,4,1,4,3,3,1,2.8235295,Tuesday,Undecided,7,Strongly agree,,Somewhat disagree,Undecided,Undecided,Somewhat agree,Somewhat agree,Strongly agree,I got more practice at classroom management. I need to make sure I don't overcorrect behaviors - I did this at the end with Ethan's fidgeting.,"I asked students to stop distracting behaviors and gave them a replacement behavior.

I stayed calm and didn't judge students; I made sure to phrase my directions in ways that weren't mean or disrespectful.",,"Ethan had a rough time! He struggled to manage his impulses to talk about other topics, but was able to take feedback about distracting behaviors.","Ethan has a lot of energy and is excited to see his friends after a long summer break. However, he was mostly able to respond to prompts. I would want to know if these behaviors are consistent or vary throughout the day. I would also like to know if these behaviors carried over from the year before.",,Coaching could help me handle student distractions more easily on the second go around.,"A talking stick might help students know who is talking and who is listening. I might implement a token economy for incentivizing listening. I would likely set aside time to talk about Star Wars/Rocket Club/anything else that's going on in their lives, most likely early in the morning.",Somewhat agree,Somewhat disagree,npg7wf,No Coaching,Black,No Coaching,Black,Elem Tues,12,3,4,2,4,4,3,3,4,4,4,3,4,4,4,4,4,4,3.6470587,9,5,6,8,6,8,6,5,8,5,5,6,4,8,5,8,8,5,5,8,6,7,4,4,5,7.875,5.125,5.125,6.0416665,7,7,6,6,6,6.4000001,0
,,,,,,,7/20/19 10:29,,,,,,,,,,Stephanie,93,1,1,1,1,1,1,0,1,1,1,0,1,,10,37,2,,11,,0,0,1,,1,1,1,1,0,1,0,1,1,1,,1,,,40,23,3,,4,Became less calm throughout and got frustrated ,"'-	at beginning smiling, positive tone
-	tone and facial expression towards ethan changed to being less calm
",2,"'-	2 norms and rationale
-	ignored two behaviors
-	33% success on redirections
-	affect became frustrated
-	dialogue focused on behaviors or was not moving because of the behaviors happening
",8,3,93_2,0,6,4,2,4,4,0,60,70,2,0.666666667,15,0.5,17.5,Ethan humming,,,,,,,,,,,,,,,,,,,,,,,,,,,,,,,,,,,,,,,,,,,,,,,,,,,,,,,,,,,,,,,,,,,,,,,,,,,,,,,,,,,,,,,,,,,,,,,,,,,,oce7ph@virginia.edu,oce7ph@virginia.edu,3,1,10,10,1,8,3,10,1,6,5,4,7,10,1,10,1,2,9,3,8,3,8,6,5,10,1,Not at all,Just a little,Very much,Not at all,Just a little,Pretty much,Very much,Very much,Not at all,Not at all,2.357142857,3,1.6,Very much,Just a little,Pretty much,Not at all,0,2018,3,10,Sociology ,2,2018-19,39,24,10,25,50,30,53,32,50,31,56,52,15,20,55,12,43,30,20,20,44,54,15,45,33,63,65,36.51852,2,0,1,0,1,2,2,3,2,0,1,2,1,1,2,0,0,1,1,1,0,1.1428572,0.42857143,1.7142857,5,Coaching conversation,Coaching,White,1,6,5,3,2,6,6,6,6,4,2,7,4.818182,2,2,2,2,2,2,2,1,5,3,4,2,1,2,2,2,1,2,1,2.1666667,2,,3,2,3,3,6,,1_1819_3_93,3,1,1819,5,5,5,5,4,4.8000002,2.6,8.75,5,"Elwell,Olivia Clark",5,3,4,4,4,3,4,3,5,3,3,4,4,5,2,3,4,4,4,4,4,3,5,4,3,2,4,4,4,4,4,4,5,4,5,2,4,4,4,4,2,4,4,5,5,4,4,4,5,3,2,3,4,4,3,2,4,4,4,4,4.3333335,3.6666667,3.75,3,4.0833335,36,1,,elementary,No,,,,,,TW,5,,0.8710284,3,3,3,4,3,3,3,3,4,3,2,4,4,3,3,4,3,3.2352941,Tuesday,Somewhat agree,8,Somewhat agree,7,Undecided,Strongly disagree,Somewhat agree,Somewhat agree,Somewhat agree,Somewhat agree,,"I set expectations of taking turns to talk so everyone can be heard.
I set the expectation that students come prepared and ready to learn. 
I set the expectation that students come without distractions such as electronic devices. ",,"distracted 
disengaged ",He could be distracted by other students behaviors this is why it would be important for him to have a classroom that is set up to miinimize distractions.,"I directed students to find textual evidence.
I gave specific and positive feedback.
",,a clear behavior management plan ,Somewhat agree,Strongly disagree,oce7ph,No Coaching,White,No Coaching,White,Elem Tues,31,4,4,4,4,4,3,4,4,5,5,5,4,5,4,4,5,5,4.2941175,9,7,6,7,6,5,9,6,7,9,5,6,8,6,6,6,7,5,2,5,7,5,6,6,5,6,5.25,7.125,6.125,6,6,7,6,6,6.1999998,0
,,,,,,,3/26/19 13:06,,,,,,,,,,Rachel L,93,1,1,1,1,1,1,1,1,1,1,1,1,38,6,32,33,33,4,0,0,0,0,1,1,1,1,1,1,0,0,1,1,1,1,,,16,49,25,7,23,7,slightly flustered,Tries to ignore Ethan‚Äôs misbehavior; sometimes TC repeats Ethan‚Äôs name multiple times rather than trying to give a redirection.,4,"TC is not able to support students in generating any classroom norms (comes up with some herself). TC is largely unsuccessful with redirecting student misbehavior. Distractions are lengthy, which definitely detracts from the discussion about classroom norms. There were very few moments when all students were engaged. TC remains mostly calm, but shows some signs of being flustered. ",5,1,93_2,1,6,6,2,4,4,0,146,127,4,1,24.33333333,0.333333333,21.16666667,Ethan humming,,,,,,,,,,,,,,,,,,,,,,,,,,,,,,,,,,,,,,,,,,,,,,,,,,,,,,,,,,,,,,,,,,,,,,,,,,,,,,,,,,,,,,,,,,,,,,,,,oce7ph@virginia.edu,Casedy,Carrie,oce7ph@virginia.edu,oce7ph@virginia.edu,,,,,,,,,,,,,,,,,,,,,,,,,,,,,,,,,,,,,,,,,,,,,,,,,,,,,,,,,,,,,,,,,,,,,,,,,,,,,,,,,,,,,,,,,,,,,,,,,,,,,,,,,,,,,,,,,,,,,,,,,,,,,,,,,,,,,,,,,,,,,,,,,,,,,,,,,,,,,,,,,,,,,,,,,,,,,,,,,,,,,,,,,,,,,,,,,,,,,,,,,,,,,,,,,,,,,,,,,,,,,,,,,,,,,,,,,,,,,,,,,,,,,,,,,,,,,,,,,,,,,,,,,,,,,,,,,,,,,,,,,,,,,,,,,,,,,,,,,,,,,,,,,,,,,,,,,,,,,,,,,,,,,,,,,,,,,,,,,,,,,1
,,,,,,,,,,,,,,,,,,,,,,,,,,,,,,,,,,,,,,,,,,,,,,,,,,,,,,,,,,,,,,,,,,0,,,,,,,,,,,,,,,,,,,,,,,,,,,,,,,,,,,,,,,,,,,,,,,,,,,,,,,,,,,,,,,,,,,,,,,,,,,,,,,,,,,,,,,,,,,,,,,,,,,,,,,,,,,,,,,,,,,,,oce7ph@virginia.edu,3,4,7,3,8,5,6,8,3,7,4,2,9,5,6,5,6,1,10,2,9,1,10,9,2,8,3,Not at all,Not at all,Pretty much,Not at all,Very much,Just a little,Very much,Pretty much,Just a little,Not at all,2.285714286,3.2,1.4,Pretty much,Pretty much,Pretty much,Not at all,0,2018,3,10,Sociology ,2,2018-19,39,24,10,25,50,30,53,32,50,31,56,52,15,20,55,12,43,30,20,20,44,54,15,45,33,63,65,36.51852,2,0,1,0,1,2,2,3,2,0,1,2,1,1,2,0,0,1,1,1,0,1.1428572,0.42857143,1.7142857,5,Coaching conversation,Coaching,White,1,6,5,3,2,6,6,6,6,4,2,7,4.818182,2,2,2,2,2,2,2,1,5,3,4,2,1,2,2,2,1,2,1,2.1666667,2,,3,2,3,3,6,,1_1819_3_93,3,1,1819,5,5,5,5,4,4.8000002,2,6.25,5,"Elwell,Olivia Clark",5,3,4,4,4,3,4,3,5,3,3,4,4,5,2,3,4,4,4,4,4,3,5,4,3,2,4,4,4,4,4,4,5,4,5,2,4,4,4,4,2,4,4,5,5,4,4,4,5,3,2,3,4,4,3,2,4,4,4,4,4.3333335,3.6666667,3.75,3,4.0833335,36,1,,elementary,,,,,,,TW,5,,0.8710284,3,3,3,4,3,3,3,3,4,3,2,4,4,3,3,4,3,3.2352941,Tuesday,Strongly agree,3,Strongly agree,4,Somewhat agree,Strongly agree,Somewhat agree,Strongly agree,Strongly agree,Somewhat agree,being able to practice what i have been learning in class  on the simulated students ,"1) Tried to keep kids engaged in the lesson 
2) made sure each student was able to speak when it was their turn
",,"distracted 
disruptive ","need for attention
trying to avoid doing school work ","1) Asked to find evidence in the text 
2) Asked them to explain their thought process ",,"a separate space for students to regroup and refocus
a behavior management system for noise/disruption in the classroom ( ex.marble jar, piggy bank) ",Somewhat agree,Somewhat agree,oce7ph,No Coaching,White,No Coaching,White,Elem Tues,31,4,4,4,4,4,3,4,4,5,5,5,4,5,4,4,5,5,4.2941175,9,7,6,7,6,5,9,6,7,9,5,6,8,6,6,6,7,5,2,5,7,5,6,6,5,6,5.25,7.125,6.125,6,6,7,6,6,6.1999998,0
,,,,,,,3/31/19 9:17,,,,,,,,,,Maggie,93,1,1,1,1,1,1,1,1,1,1,1,,17,1,14,11,10,,0,1,1,0,1,,1,0,0,1,0,,1,,,1,,,35,41,24,28,41,,Increasingly more annoyed,"Changing facial expressions when redirecting behavior, and tone changes when giving redirections. ",3,TC Supported students in generating 1 classroom expectation. TC attempted with mixed success to redirect off task behavior. Disruptions were lengthy and detracted from the class. TC candidate affect is for the most part calm but occasional instances where they appear otherwise. ,6,2,93_2,1,6,5,3,2,2,0,53,169,3,0.833333333,10.6,0.6,33.8,Ethan video game,,,,,,,,,,,,,,,,,,,,,,,,,,,,,,,,,,,,,,,,,,,,,,,,,,,,,,,,,,,,,,,,,,,,,,,,,,,,,,,,,,,,,,,,,,,,,,,,,oce7ph@virginia.edu,Casedy,Carrie,oce7ph@virginia.edu,oce7ph@virginia.edu,3,4,7,8,3,9,2,10,1,5,6,2,9,8,3,10,1,2,9,4,7,1,10,9,2,7,4,Not at all,Just a little,Very much,Not at all,Pretty much,Pretty much,Very much,Pretty much,Not at all,Not at all,2.285714286,3,1.6,Pretty much,Just a little,Pretty much,Not at all,0,2018,3,10,Sociology ,2,2018-19,39,24,10,25,50,30,53,32,50,31,56,52,15,20,55,12,43,30,20,20,44,54,15,45,33,63,65,36.51852,2,0,1,0,1,2,2,3,2,0,1,2,1,1,2,0,0,1,1,1,0,1.1428572,0.42857143,1.7142857,5,Coaching conversation,Coaching,White,1,6,5,3,2,6,6,6,6,4,2,7,4.818182,2,2,2,2,2,2,2,1,5,3,4,2,1,2,2,2,1,2,1,2.1666667,2,,3,2,3,3,6,,1_1819_3_93,3,1,1819,5,5,5,5,4,4.8000002,2.6,8.25,5,"Elwell,Olivia Clark",5,3,4,4,4,3,4,3,5,3,3,4,4,5,2,3,4,4,4,4,4,3,5,4,3,2,4,4,4,4,4,4,5,4,5,2,4,4,4,4,2,4,4,5,5,4,4,4,5,3,2,3,4,4,3,2,4,4,4,4,4.3333335,3.6666667,3.75,3,4.0833335,36,1,,elementary,,,,,,,TW,5,,0.8710284,3,3,3,4,3,3,3,3,4,3,2,4,4,3,3,4,3,3.2352941,Tuesday,Somewhat agree,3,Strongly agree,,Somewhat agree,Strongly agree,Somewhat agree,Strongly agree,Strongly agree,Somewhat agree,it was a good opportunity to try to practice what I have been learning in behavior management. ,"I think I was direct in my expectations for most of the simulation.
I could have addressed the misbehavior sooner in order to create a more productive discussion with the entire class.",,"'-Disruptive in using his voice at inappropriate times and distracted by/ distracting  to classmates. 

-He participated but not in a meaningful ways that contributed to the class discussion. 
","'-I would want to find out more about Ethan's background, home life, past school experiences that may be contributing to his behavior. 
-I would want to get to know Ethan as a learner in my classroom, what interests him to use this to try to hook him into classroom discussions. 
- I would want to know more about his relationships with his classmates and how I can better help him interact with them in appropriate ways. ",,,"'-Firm understanding of the classroom behavior expectation.
-Clear Reasons for why we follow these expectations for our behavior in the classroom. 
-Follow through on what is expected and what is not",Somewhat agree,Somewhat agree,oce7ph,No Coaching,White,No Coaching,White,Elem Tues,31,4,4,4,4,4,3,4,4,5,5,5,4,5,4,4,5,5,4.2941175,9,7,6,7,6,5,9,6,7,9,5,6,8,6,6,6,7,5,2,5,7,5,6,6,5,6,5.25,7.125,6.125,6,6,7,6,6,6.1999998,0
,,,,,,,7/20/19 9:03,,,,,,,,,,Stephanie,47,1,1,1,1,1,1,1,1,1,1,1,1,7,5,5,7,5,4,1,0,0,1,1,1,0,0,0,0,0,0,,,,,,,10,51,34,33,12,16,Calm and patient- got a little frustrated with Ethan at the end,"'-	smiling and positive
-	continued to try to engaged Ethan
-	hand motions showed frustration",4,"'-	discussed one norm no rationale
-	TC was successful 67% on redirections
-	Redirections were lengthy, but students also got to talk about goals for year
-	overall calm, got frustrated at the end",8,3,47_2,1,6,6,4,0,0,0,33,156,4,1,5.5,0.666666667,26,Ethan humming,,,,,,,,,,,,,,,,,,,,,,,,,,,,,,,,,,,,,,,,,,,,,,,,,,,,,,,,,,,,,,,,,,,,,,,,,,,,,,,,,,,,,,,,,,,,,,,,,,,,orb5kc@virginia.edu,orb5kc@virginia.edu,1,2,9,9,2,9,2,9,2,9,2,4,7,9,2,9,2,2,9,5,6,2,9,9,2,9,2,Not at all,Not at all,Pretty much,Not at all,Not at all,Pretty much,Pretty much,Pretty much,Not at all,Not at all,2,2.6,1.4,Pretty much,Pretty much,Pretty much,Not at all,1,2018,3.79,10,Youth and Social Innovation,1,2018-19,75,69,77,80,88,89,84,96,84,90,100,90,82,84,86,91,85,85,87,85,89,100,88,91,92,100,79,86.888885,2,2,0,0,1,0,0,0,0,0,0,0,0,0,0,0,0,0,0,0,0,0.2857143,0.14285715,0.2857143,4,Coaching conversation,Coaching,White,1,5,5,5,5,5,5,5,5,5,5,5,5,2,2,2,3,2,2,2,3,5,3,2,4,2,4,5,4,2,3,4,3.4166667,2,,2,2,3,3,6,,1_1819_2_47,2,1,1819,5,5,5,5,5,5,3,9,3,"Bunting,Olivia R.",2,4,2,4,3,3,5,2,4,4,2,4,1,5,1,1,4,4,5,4,2,4,3,4,3,2,4,1,4,3,2,4,4,4,4,2,4,2,4,4,4,4,2,3,3,2,4,4,3,4,3,4,4,4,2,3,4,3,2,4,3.8333333,3.25,4.0833335,2.3333333,2.6666667,39,4,,elementary,No,,,,,,TW,5,,0.9953396,3,4,2,3,4,3,3,3,4,4,4,4,4,4,3,3,4,3.4705882,Monday,Strongly disagree,8,Strongly agree,9,Strongly disagree,Strongly disagree,Strongly disagree,Strongly disagree,Strongly disagree,Strongly agree,nothing,"I was concise and firm, I framed the discussion in terms of their hopes and dreams",not very helpful,distracted,"disability, disinterest, bad day","I told them to use evidence form the text

I explained meanings of words ",make the experience more real,"behavior expectations and practice!
",Strongly disagree,Strongly disagree,orb5kc,Coaching,White,Coaching,White,Elem Mon,39,4,4,2,4,2,4,4,4,2,4,4,4,4,4,4,4,4,3.6470587,10,9,7,9,7,5,7,7,9,7,7,7,9,7,9,7,7,9,9,7,7,9,9,9,9,7.5,8,8,7.8333335,6,5,7,7,7,6.4000001,0
